{
  "categories": [
    "baseline-curated"
  ],
  "curation": {
    "gap_notes": [
      "No verified source repository yet.",
      "No verified OpenAPI/Swagger surface yet.",
      "No verified subnet API surface yet.",
      "No verified SSE/event stream yet."
    ],
    "level": "machine-verified",
    "review_state": "machine-generated",
    "reviewed_at": null,
    "source_count": 3,
    "verified_at": "2026-06-06T07:17:48.132Z"
  },
  "dashboard_url": "https://taomarketcap.com/subnets/72",
  "docs_url": "https://docs.natix.network/whitepaper",
  "links": [],
  "name": "StreetVision by NATIX",
  "netuid": 72,
  "notes": "Machine-generated baseline overlay from verified public-source candidates.",
  "schema_version": 1,
  "slug": "sn-72",
  "status": "active",
  "surfaces": [
    {
      "auth_required": false,
      "authority": "registry-observed",
      "id": "sn-72-taomarketcap-website",
      "kind": "website",
      "name": "StreetVision by NATIX website",
      "notes": "Discovered from TaoMarketCap subnet identity metadata. Not probed or verified by Metagraphed.",
      "probe": {
        "enabled": true,
        "expect": "any",
        "method": "HEAD",
        "timeout_ms": 10000
      },
      "provider": "taomarketcap",
      "public_safe": true,
      "rate_limit_notes": "Candidate only; no recurring probe is configured until maintainer review.",
      "source_urls": [
        "https://api.taomarketcap.com/public/v1/subnets/72"
      ],
      "url": "https://www.natix.network/?utm_source=bittensor",
      "verification": {
        "classification": "live",
        "content_type": "text/html; charset=utf-8",
        "latency_ms": 146,
        "method_tested": "HEAD",
        "redirect_target": null,
        "status_code": 200,
        "verified_at": "2026-06-06T07:17:48.067Z"
      }
    },
    {
      "auth_required": false,
      "authority": "registry-observed",
      "id": "sn-72-website-link-www-natix-network-docs-10",
      "kind": "docs",
      "name": "StreetVision by NATIX docs",
      "notes": "Discovered from a public project website link. Requires verification before promotion.",
      "probe": {
        "enabled": true,
        "expect": "any",
        "method": "HEAD",
        "timeout_ms": 10000
      },
      "provider": "taomarketcap",
      "public_safe": true,
      "rate_limit_notes": "Candidate only; no recurring probe is configured until maintainer review.",
      "source_urls": [
        "https://www.natix.network/?utm_source=bittensor"
      ],
      "url": "https://docs.natix.network/whitepaper",
      "verification": {
        "classification": "live",
        "content_type": "text/html; charset=utf-8",
        "latency_ms": 237,
        "method_tested": "HEAD",
        "redirect_target": null,
        "status_code": 200,
        "verified_at": "2026-06-06T07:17:48.132Z"
      }
    },
    {
      "auth_required": false,
      "authority": "registry-observed",
      "id": "sn-72-taomarketcap-dashboard",
      "kind": "dashboard",
      "name": "StreetVision by NATIX TaoMarketCap dashboard",
      "notes": "Universal TaoMarketCap subnet dashboard candidate. Third-party enrichment, not protocol authority.",
      "probe": {
        "enabled": true,
        "expect": "any",
        "method": "HEAD",
        "timeout_ms": 10000
      },
      "provider": "taomarketcap",
      "public_safe": true,
      "rate_limit_notes": "Candidate only; no recurring probe is configured until maintainer review.",
      "source_urls": [
        "https://api.taomarketcap.com/public/v1/subnets/72"
      ],
      "url": "https://taomarketcap.com/subnets/72",
      "verification": {
        "classification": "live",
        "content_type": "text/html; charset=utf-8",
        "latency_ms": 188,
        "method_tested": "HEAD",
        "redirect_target": null,
        "status_code": 200,
        "verified_at": "2026-06-06T07:17:48.043Z"
      }
    },
    {
      "auth_required": false,
      "authority": "registry-observed",
      "id": "sn-72-github-readme-natixnetwork-streetvision-subnet-data-artifact-1",
      "kind": "data-artifact",
      "name": "StreetVision by NATIX data artifact",
      "notes": "Discovered from a public GitHub README link. Requires verification before promotion.",
      "probe": {
        "enabled": true,
        "expect": "any",
        "method": "HEAD",
        "timeout_ms": 10000
      },
      "provider": "taomarketcap",
      "public_safe": true,
      "rate_limit_notes": "Candidate only; no recurring probe is configured until maintainer review.",
      "source_urls": [
        "https://github.com/natixnetwork/streetvision-subnet/blob/main/README.md"
      ],
      "url": "https://huggingface.co/natix-network-org",
      "verification": {
        "classification": "live",
        "content_type": "text/html; charset=utf-8",
        "latency_ms": 125,
        "method_tested": "HEAD",
        "redirect_target": null,
        "status_code": 200,
        "verified_at": "2026-06-06T07:17:47.995Z"
      }
    }
  ],
  "website_url": "https://www.natix.network/?utm_source=bittensor"
}
