{
  "categories": [
    "baseline-curated"
  ],
  "curation": {
    "gap_notes": [
      "No verified project docs surface yet.",
      "No verified source repository yet.",
      "No verified project website yet.",
      "No verified OpenAPI/Swagger surface yet.",
      "No verified subnet API surface yet.",
      "No verified SSE/event stream yet.",
      "No verified data artifact yet."
    ],
    "level": "machine-verified",
    "review_state": "machine-generated",
    "reviewed_at": null,
    "source_count": 1,
    "verified_at": "2026-06-06T07:18:04.069Z"
  },
  "dashboard_url": "https://taomarketcap.com/subnets/109",
  "links": [],
  "name": "Academia",
  "netuid": 109,
  "notes": "Machine-generated baseline overlay from verified public-source candidates.",
  "schema_version": 1,
  "slug": "sn-109",
  "status": "active",
  "surfaces": [
    {
      "auth_required": false,
      "authority": "registry-observed",
      "id": "sn-109-taomarketcap-dashboard",
      "kind": "dashboard",
      "name": "Academia TaoMarketCap dashboard",
      "notes": "Universal TaoMarketCap subnet dashboard candidate. Third-party enrichment, not protocol authority.",
      "probe": {
        "enabled": true,
        "expect": "any",
        "method": "HEAD",
        "timeout_ms": 10000
      },
      "provider": "taomarketcap",
      "public_safe": true,
      "rate_limit_notes": "Candidate only; no recurring probe is configured until maintainer review.",
      "source_urls": [
        "https://api.taomarketcap.com/public/v1/subnets/109"
      ],
      "url": "https://taomarketcap.com/subnets/109",
      "verification": {
        "classification": "live",
        "content_type": "text/html; charset=utf-8",
        "latency_ms": 157,
        "method_tested": "HEAD",
        "redirect_target": null,
        "status_code": 200,
        "verified_at": "2026-06-06T07:18:04.069Z"
      }
    }
  ]
}
