{
  "categories": [
    "baseline-curated"
  ],
  "curation": {
    "gap_notes": [
      "No verified OpenAPI/Swagger surface yet.",
      "No verified subnet API surface yet.",
      "No verified SSE/event stream yet.",
      "No verified data artifact yet."
    ],
    "level": "machine-verified",
    "review_state": "machine-generated",
    "reviewed_at": null,
    "source_count": 2,
    "verified_at": "2026-06-06T07:17:36.002Z"
  },
  "dashboard_url": "https://taomarketcap.com/subnets/44",
  "docs_url": "https://github.com/tensorplex-labs/subnet-docs/tree/main/data/44",
  "links": [],
  "name": "Score",
  "netuid": 44,
  "notes": "Machine-generated baseline overlay from verified public-source candidates.",
  "schema_version": 1,
  "slug": "sn-44",
  "source_repo": "https://github.com/score-technologies/turbovision",
  "status": "active",
  "surfaces": [
    {
      "auth_required": false,
      "authority": "registry-observed",
      "id": "sn-44-taomarketcap-source-repo",
      "kind": "source-repo",
      "name": "Score source repository",
      "notes": "Discovered from TaoMarketCap subnet identity metadata. Not probed or verified by Metagraphed.",
      "probe": {
        "enabled": true,
        "expect": "any",
        "method": "HEAD",
        "timeout_ms": 10000
      },
      "provider": "taomarketcap",
      "public_safe": true,
      "rate_limit_notes": "Candidate only; no recurring probe is configured until maintainer review.",
      "source_urls": [
        "https://api.taomarketcap.com/public/v1/subnets/44"
      ],
      "url": "https://github.com/score-technologies/turbovision",
      "verification": {
        "archived": false,
        "classification": "live",
        "content_type": null,
        "default_branch": "main",
        "github_api_url": "https://api.github.com/repos/score-technologies/turbovision",
        "homepage": null,
        "last_push_at": "2026-06-05T08:26:57Z",
        "redirect_target": null,
        "topics": [],
        "verified_at": "2026-06-06T07:17:36.000Z"
      }
    },
    {
      "auth_required": false,
      "authority": "registry-observed",
      "id": "sn-44-tensorplex-source-repo-1",
      "kind": "source-repo",
      "name": "Score source repository",
      "notes": "Discovered from Tensorplex subnet-docs. Not probed or verified by Metagraphed.",
      "probe": {
        "enabled": true,
        "expect": "any",
        "method": "HEAD",
        "timeout_ms": 10000
      },
      "provider": "tensorplex-subnet-docs",
      "public_safe": true,
      "rate_limit_notes": "Candidate only; no recurring probe is configured until maintainer review.",
      "source_urls": [
        "https://github.com/tensorplex-labs/subnet-docs/blob/main/data/44/subnet.json"
      ],
      "url": "https://github.com/score-technologies/score-vision",
      "verification": {
        "archived": false,
        "classification": "live",
        "content_type": null,
        "default_branch": "main",
        "github_api_url": "https://api.github.com/repos/score-technologies/score-vision",
        "homepage": null,
        "last_push_at": "2025-12-05T09:05:34Z",
        "redirect_target": null,
        "topics": [],
        "verified_at": "2026-06-06T07:17:36.002Z"
      }
    },
    {
      "auth_required": false,
      "authority": "registry-observed",
      "id": "sn-44-taomarketcap-website",
      "kind": "website",
      "name": "Score website",
      "notes": "Discovered from TaoMarketCap subnet identity metadata. Not probed or verified by Metagraphed.",
      "probe": {
        "enabled": true,
        "expect": "any",
        "method": "HEAD",
        "timeout_ms": 10000
      },
      "provider": "taomarketcap",
      "public_safe": true,
      "rate_limit_notes": "Candidate only; no recurring probe is configured until maintainer review.",
      "source_urls": [
        "https://api.taomarketcap.com/public/v1/subnets/44"
      ],
      "url": "https://www.wearescore.com/",
      "verification": {
        "classification": "live",
        "content_type": "text/html; charset=utf-8",
        "latency_ms": 566,
        "method_tested": "HEAD",
        "redirect_target": null,
        "status_code": 200,
        "verified_at": "2026-06-06T07:17:36.001Z"
      }
    },
    {
      "auth_required": false,
      "authority": "registry-observed",
      "id": "sn-44-tensorplex-docs",
      "kind": "docs",
      "name": "Score Tensorplex subnet docs",
      "notes": "Discovered from Tensorplex subnet-docs. Useful as documentation enrichment, not verified operational authority.",
      "probe": {
        "enabled": true,
        "expect": "any",
        "method": "HEAD",
        "timeout_ms": 10000
      },
      "provider": "tensorplex-subnet-docs",
      "public_safe": true,
      "rate_limit_notes": "Candidate only; no recurring probe is configured until maintainer review.",
      "source_urls": [
        "https://github.com/tensorplex-labs/subnet-docs/blob/main/data/44/subnet.json"
      ],
      "url": "https://github.com/tensorplex-labs/subnet-docs/tree/main/data/44",
      "verification": {
        "classification": "live",
        "content_type": "text/html; charset=utf-8",
        "latency_ms": 379,
        "method_tested": "HEAD",
        "redirect_target": null,
        "status_code": 200,
        "verified_at": "2026-06-06T07:17:36.002Z"
      }
    },
    {
      "auth_required": false,
      "authority": "registry-observed",
      "id": "sn-44-taomarketcap-dashboard",
      "kind": "dashboard",
      "name": "Score TaoMarketCap dashboard",
      "notes": "Universal TaoMarketCap subnet dashboard candidate. Third-party enrichment, not protocol authority.",
      "probe": {
        "enabled": true,
        "expect": "any",
        "method": "HEAD",
        "timeout_ms": 10000
      },
      "provider": "taomarketcap",
      "public_safe": true,
      "rate_limit_notes": "Candidate only; no recurring probe is configured until maintainer review.",
      "source_urls": [
        "https://api.taomarketcap.com/public/v1/subnets/44"
      ],
      "url": "https://taomarketcap.com/subnets/44",
      "verification": {
        "classification": "live",
        "content_type": "text/html; charset=utf-8",
        "latency_ms": 307,
        "method_tested": "HEAD",
        "redirect_target": null,
        "status_code": 200,
        "verified_at": "2026-06-06T07:17:35.998Z"
      }
    }
  ],
  "website_url": "https://www.wearescore.com/"
}
