{
  "categories": [
    "baseline-curated"
  ],
  "curation": {
    "gap_notes": [
      "No verified source repository yet.",
      "No verified project website yet.",
      "No verified OpenAPI/Swagger surface yet.",
      "No verified subnet API surface yet.",
      "No verified SSE/event stream yet.",
      "No verified data artifact yet."
    ],
    "level": "machine-verified",
    "review_state": "machine-generated",
    "reviewed_at": null,
    "source_count": 2,
    "verified_at": "2026-06-06T07:17:52.650Z"
  },
  "dashboard_url": "https://taomarketcap.com/subnets/84",
  "docs_url": "https://docs.learnbittensor.org/btcli",
  "links": [],
  "name": "ansuz",
  "netuid": 84,
  "notes": "Machine-generated baseline overlay from verified public-source candidates.",
  "schema_version": 1,
  "slug": "sn-84",
  "status": "active",
  "surfaces": [
    {
      "auth_required": false,
      "authority": "registry-observed",
      "id": "sn-84-github-readme-tatsuproject-chipforge-sn84-docs-1",
      "kind": "docs",
      "name": "ansuz docs",
      "notes": "Discovered from a public GitHub README link. Requires verification before promotion.",
      "probe": {
        "enabled": true,
        "expect": "any",
        "method": "HEAD",
        "timeout_ms": 10000
      },
      "provider": "tensorplex-subnet-docs",
      "public_safe": true,
      "rate_limit_notes": "Candidate only; no recurring probe is configured until maintainer review.",
      "source_urls": [
        "https://github.com/TatsuProject/ChipForge_SN84/blob/master/README.md"
      ],
      "url": "https://docs.learnbittensor.org/btcli",
      "verification": {
        "classification": "live",
        "content_type": "text/html; charset=utf-8",
        "latency_ms": 48,
        "method_tested": "HEAD",
        "redirect_target": null,
        "status_code": 200,
        "verified_at": "2026-06-06T07:17:52.616Z"
      }
    },
    {
      "auth_required": false,
      "authority": "registry-observed",
      "id": "sn-84-taomarketcap-dashboard",
      "kind": "dashboard",
      "name": "ansuz TaoMarketCap dashboard",
      "notes": "Universal TaoMarketCap subnet dashboard candidate. Third-party enrichment, not protocol authority.",
      "probe": {
        "enabled": true,
        "expect": "any",
        "method": "HEAD",
        "timeout_ms": 10000
      },
      "provider": "taomarketcap",
      "public_safe": true,
      "rate_limit_notes": "Candidate only; no recurring probe is configured until maintainer review.",
      "source_urls": [
        "https://api.taomarketcap.com/public/v1/subnets/84"
      ],
      "url": "https://taomarketcap.com/subnets/84",
      "verification": {
        "classification": "live",
        "content_type": "text/html; charset=utf-8",
        "latency_ms": 184,
        "method_tested": "HEAD",
        "redirect_target": null,
        "status_code": 200,
        "verified_at": "2026-06-06T07:17:52.650Z"
      }
    }
  ]
}
