{
  "categories": [
    "baseline-curated"
  ],
  "curation": {
    "gap_notes": [
      "No verified subnet API surface yet.",
      "No verified SSE/event stream yet."
    ],
    "level": "machine-verified",
    "review_state": "machine-generated",
    "reviewed_at": null,
    "source_count": 4,
    "verified_at": "2026-06-06T07:17:33.066Z"
  },
  "dashboard_url": "https://taomarketcap.com/subnets/34",
  "docs_url": "https://github.com/tensorplex-labs/subnet-docs/tree/main/data/34",
  "links": [],
  "name": "BitMind",
  "netuid": 34,
  "notes": "Machine-generated baseline overlay from verified public-source candidates.",
  "schema_version": 1,
  "slug": "sn-34",
  "source_repo": "https://github.com/BitMind-AI/bitmind-subnet",
  "status": "active",
  "surfaces": [
    {
      "auth_required": false,
      "authority": "registry-observed",
      "id": "sn-34-taomarketcap-source-repo",
      "kind": "source-repo",
      "name": "BitMind source repository",
      "notes": "Discovered from TaoMarketCap subnet identity metadata. Not probed or verified by Metagraphed.",
      "probe": {
        "enabled": true,
        "expect": "any",
        "method": "HEAD",
        "timeout_ms": 10000
      },
      "provider": "taomarketcap",
      "public_safe": true,
      "rate_limit_notes": "Candidate only; no recurring probe is configured until maintainer review.",
      "source_urls": [
        "https://api.taomarketcap.com/public/v1/subnets/34",
        "https://github.com/tensorplex-labs/subnet-docs/blob/main/data/34/subnet.json"
      ],
      "url": "https://github.com/BitMind-AI/bitmind-subnet",
      "verification": {
        "archived": false,
        "classification": "live",
        "content_type": null,
        "default_branch": "main",
        "github_api_url": "https://api.github.com/repos/BitMind-AI/bitmind-subnet",
        "homepage": "https://bitmind.ai/",
        "last_push_at": "2026-06-05T02:16:46Z",
        "redirect_target": null,
        "topics": [],
        "verified_at": "2026-06-06T07:17:33.040Z"
      }
    },
    {
      "auth_required": false,
      "authority": "registry-observed",
      "id": "sn-34-github-readme-bitmind-ai-bitmind-subnet-website-3",
      "kind": "website",
      "name": "BitMind website page",
      "notes": "Discovered from a public GitHub README link. Requires verification before promotion.",
      "probe": {
        "enabled": true,
        "expect": "any",
        "method": "HEAD",
        "timeout_ms": 10000
      },
      "provider": "taomarketcap",
      "public_safe": true,
      "rate_limit_notes": "Candidate only; no recurring probe is configured until maintainer review.",
      "source_urls": [
        "https://github.com/BitMind-AI/bitmind-subnet/blob/main/README.md"
      ],
      "url": "https://github.com/BitMind-AI/bitmind-subnet.git",
      "verification": {
        "classification": "redirected",
        "content_type": "text/html; charset=utf-8",
        "latency_ms": 528,
        "method_tested": "HEAD",
        "redirect_target": "https://github.com/BitMind-AI/bitmind-subnet",
        "status_code": 200,
        "verified_at": "2026-06-06T07:17:33.001Z"
      }
    },
    {
      "auth_required": false,
      "authority": "registry-observed",
      "id": "sn-34-tensorplex-docs",
      "kind": "docs",
      "name": "BitMind Tensorplex subnet docs",
      "notes": "Discovered from Tensorplex subnet-docs. Useful as documentation enrichment, not verified operational authority.",
      "probe": {
        "enabled": true,
        "expect": "any",
        "method": "HEAD",
        "timeout_ms": 10000
      },
      "provider": "tensorplex-subnet-docs",
      "public_safe": true,
      "rate_limit_notes": "Candidate only; no recurring probe is configured until maintainer review.",
      "source_urls": [
        "https://github.com/tensorplex-labs/subnet-docs/blob/main/data/34/subnet.json"
      ],
      "url": "https://github.com/tensorplex-labs/subnet-docs/tree/main/data/34",
      "verification": {
        "classification": "live",
        "content_type": "text/html; charset=utf-8",
        "latency_ms": 418,
        "method_tested": "HEAD",
        "redirect_target": null,
        "status_code": 200,
        "verified_at": "2026-06-06T07:17:33.041Z"
      }
    },
    {
      "auth_required": false,
      "authority": "registry-observed",
      "id": "sn-34-website-common-docs",
      "kind": "docs",
      "name": "BitMind docs",
      "notes": "Common read-only path discovered from a public project website root. Requires verification before promotion.",
      "probe": {
        "enabled": true,
        "expect": "any",
        "method": "HEAD",
        "timeout_ms": 10000
      },
      "provider": "taomarketcap",
      "public_safe": true,
      "rate_limit_notes": "Candidate only; no recurring probe is configured until maintainer review.",
      "source_urls": [
        "https://github.com/BitMind-AI/bitmind-subnet.git"
      ],
      "url": "https://github.com/docs",
      "verification": {
        "classification": "live",
        "content_type": "text/html; charset=utf-8",
        "latency_ms": 92,
        "method_tested": "HEAD",
        "redirect_target": null,
        "status_code": 200,
        "verified_at": "2026-06-06T07:17:33.045Z"
      }
    },
    {
      "auth_required": false,
      "authority": "registry-observed",
      "id": "sn-34-taomarketcap-dashboard",
      "kind": "dashboard",
      "name": "BitMind TaoMarketCap dashboard",
      "notes": "Universal TaoMarketCap subnet dashboard candidate. Third-party enrichment, not protocol authority.",
      "probe": {
        "enabled": true,
        "expect": "any",
        "method": "HEAD",
        "timeout_ms": 10000
      },
      "provider": "taomarketcap",
      "public_safe": true,
      "rate_limit_notes": "Candidate only; no recurring probe is configured until maintainer review.",
      "source_urls": [
        "https://api.taomarketcap.com/public/v1/subnets/34"
      ],
      "url": "https://taomarketcap.com/subnets/34",
      "verification": {
        "classification": "live",
        "content_type": "text/html; charset=utf-8",
        "latency_ms": 321,
        "method_tested": "HEAD",
        "redirect_target": null,
        "status_code": 200,
        "verified_at": "2026-06-06T07:17:33.018Z"
      }
    },
    {
      "auth_required": false,
      "authority": "registry-observed",
      "id": "sn-34-website-common-swagger",
      "kind": "openapi",
      "name": "BitMind Swagger UI",
      "notes": "Common read-only path discovered from a public project website root. Requires verification before promotion.",
      "probe": {
        "enabled": true,
        "expect": "any",
        "method": "GET",
        "timeout_ms": 10000
      },
      "provider": "taomarketcap",
      "public_safe": true,
      "rate_limit_notes": "Candidate only; no recurring probe is configured until maintainer review.",
      "source_urls": [
        "https://github.com/BitMind-AI/bitmind-subnet.git"
      ],
      "url": "https://github.com/swagger",
      "verification": {
        "classification": "live",
        "content_type": "text/html; charset=utf-8",
        "latency_ms": 88,
        "method_tested": "HEAD",
        "redirect_target": null,
        "status_code": 200,
        "verified_at": "2026-06-06T07:17:33.066Z"
      }
    },
    {
      "auth_required": false,
      "authority": "registry-observed",
      "id": "sn-34-github-readme-bitmind-ai-bitmind-subnet-data-artifact-2",
      "kind": "data-artifact",
      "name": "BitMind data artifact",
      "notes": "Discovered from a public GitHub README link. Requires verification before promotion.",
      "probe": {
        "enabled": true,
        "expect": "any",
        "method": "HEAD",
        "timeout_ms": 10000
      },
      "provider": "taomarketcap",
      "public_safe": true,
      "rate_limit_notes": "Candidate only; no recurring probe is configured until maintainer review.",
      "source_urls": [
        "https://github.com/BitMind-AI/bitmind-subnet/blob/main/README.md"
      ],
      "url": "https://huggingface.co/gasstation",
      "verification": {
        "classification": "live",
        "content_type": "text/html; charset=utf-8",
        "latency_ms": 159,
        "method_tested": "HEAD",
        "redirect_target": null,
        "status_code": 200,
        "verified_at": "2026-06-06T07:17:32.995Z"
      }
    }
  ],
  "website_url": "https://github.com/BitMind-AI/bitmind-subnet.git"
}
