{
  "categories": [
    "baseline-curated"
  ],
  "curation": {
    "gap_notes": [
      "No verified OpenAPI/Swagger surface yet.",
      "No verified subnet API surface yet.",
      "No verified SSE/event stream yet.",
      "No verified data artifact yet."
    ],
    "level": "machine-verified",
    "review_state": "machine-generated",
    "reviewed_at": null,
    "source_count": 2,
    "verified_at": "2026-06-06T07:17:37.970Z"
  },
  "dashboard_url": "https://taomarketcap.com/subnets/48",
  "docs_url": "https://github.com/tensorplex-labs/subnet-docs/tree/main/data/48",
  "links": [],
  "name": "Quantum Compute",
  "netuid": 48,
  "notes": "Machine-generated baseline overlay from verified public-source candidates.",
  "schema_version": 1,
  "slug": "sn-48",
  "source_repo": "https://github.com/qbittensor-labs/quantum-compute",
  "status": "active",
  "surfaces": [
    {
      "auth_required": false,
      "authority": "registry-observed",
      "id": "sn-48-taomarketcap-source-repo",
      "kind": "source-repo",
      "name": "Quantum Compute source repository",
      "notes": "Discovered from TaoMarketCap subnet identity metadata. Not probed or verified by Metagraphed.",
      "probe": {
        "enabled": true,
        "expect": "any",
        "method": "HEAD",
        "timeout_ms": 10000
      },
      "provider": "taomarketcap",
      "public_safe": true,
      "rate_limit_notes": "Candidate only; no recurring probe is configured until maintainer review.",
      "source_urls": [
        "https://api.taomarketcap.com/public/v1/subnets/48"
      ],
      "url": "https://github.com/qbittensor-labs/quantum-compute",
      "verification": {
        "classification": "live",
        "content_type": null,
        "github_api_url": "https://api.github.com/repos/qbittensor-labs/quantum-compute",
        "latency_ms": 446,
        "method_tested": "HEAD",
        "redirect_target": null,
        "status_code": 200,
        "verified_at": "2026-06-06T07:17:37.955Z"
      }
    },
    {
      "auth_required": false,
      "authority": "registry-observed",
      "id": "sn-48-taomarketcap-website",
      "kind": "website",
      "name": "Quantum Compute website",
      "notes": "Discovered from TaoMarketCap subnet identity metadata. Not probed or verified by Metagraphed.",
      "probe": {
        "enabled": true,
        "expect": "any",
        "method": "HEAD",
        "timeout_ms": 10000
      },
      "provider": "taomarketcap",
      "public_safe": true,
      "rate_limit_notes": "Candidate only; no recurring probe is configured until maintainer review.",
      "source_urls": [
        "https://api.taomarketcap.com/public/v1/subnets/48"
      ],
      "url": "https://www.qbittensorlabs.com/",
      "verification": {
        "classification": "live",
        "content_type": "text/html; charset=utf-8",
        "latency_ms": 298,
        "method_tested": "HEAD",
        "redirect_target": null,
        "status_code": 200,
        "verified_at": "2026-06-06T07:17:37.966Z"
      }
    },
    {
      "auth_required": false,
      "authority": "registry-observed",
      "id": "sn-48-tensorplex-docs",
      "kind": "docs",
      "name": "Quantum Compute Tensorplex subnet docs",
      "notes": "Discovered from Tensorplex subnet-docs. Useful as documentation enrichment, not verified operational authority.",
      "probe": {
        "enabled": true,
        "expect": "any",
        "method": "HEAD",
        "timeout_ms": 10000
      },
      "provider": "tensorplex-subnet-docs",
      "public_safe": true,
      "rate_limit_notes": "Candidate only; no recurring probe is configured until maintainer review.",
      "source_urls": [
        "https://github.com/tensorplex-labs/subnet-docs/blob/main/data/48/subnet.json"
      ],
      "url": "https://github.com/tensorplex-labs/subnet-docs/tree/main/data/48",
      "verification": {
        "classification": "live",
        "content_type": "text/html; charset=utf-8",
        "latency_ms": 424,
        "method_tested": "HEAD",
        "redirect_target": null,
        "status_code": 200,
        "verified_at": "2026-06-06T07:17:37.970Z"
      }
    },
    {
      "auth_required": false,
      "authority": "registry-observed",
      "id": "sn-48-taomarketcap-dashboard",
      "kind": "dashboard",
      "name": "Quantum Compute TaoMarketCap dashboard",
      "notes": "Universal TaoMarketCap subnet dashboard candidate. Third-party enrichment, not protocol authority.",
      "probe": {
        "enabled": true,
        "expect": "any",
        "method": "HEAD",
        "timeout_ms": 10000
      },
      "provider": "taomarketcap",
      "public_safe": true,
      "rate_limit_notes": "Candidate only; no recurring probe is configured until maintainer review.",
      "source_urls": [
        "https://api.taomarketcap.com/public/v1/subnets/48"
      ],
      "url": "https://taomarketcap.com/subnets/48",
      "verification": {
        "classification": "live",
        "content_type": "text/html; charset=utf-8",
        "latency_ms": 138,
        "method_tested": "HEAD",
        "redirect_target": null,
        "status_code": 200,
        "verified_at": "2026-06-06T07:17:37.947Z"
      }
    }
  ],
  "website_url": "https://www.qbittensorlabs.com/"
}
