{
  "categories": [
    "baseline-curated"
  ],
  "curation": {
    "gap_notes": [
      "No verified source repository yet.",
      "No verified OpenAPI/Swagger surface yet.",
      "No verified subnet API surface yet.",
      "No verified SSE/event stream yet.",
      "No verified data artifact yet."
    ],
    "level": "machine-verified",
    "review_state": "machine-generated",
    "reviewed_at": null,
    "source_count": 2,
    "verified_at": "2026-06-06T07:18:01.388Z"
  },
  "dashboard_url": "https://taomarketcap.com/subnets/102",
  "docs_url": "https://connito.ai/docs",
  "links": [],
  "name": "ConnitoAI",
  "netuid": 102,
  "notes": "Machine-generated baseline overlay from verified public-source candidates.",
  "schema_version": 1,
  "slug": "sn-102",
  "status": "active",
  "surfaces": [
    {
      "auth_required": false,
      "authority": "registry-observed",
      "id": "sn-102-taomarketcap-website",
      "kind": "website",
      "name": "ConnitoAI website",
      "notes": "Discovered from TaoMarketCap subnet identity metadata. Not probed or verified by Metagraphed.",
      "probe": {
        "enabled": true,
        "expect": "any",
        "method": "HEAD",
        "timeout_ms": 10000
      },
      "provider": "taomarketcap",
      "public_safe": true,
      "rate_limit_notes": "Candidate only; no recurring probe is configured until maintainer review.",
      "source_urls": [
        "https://api.taomarketcap.com/public/v1/subnets/102"
      ],
      "url": "https://connito.ai/",
      "verification": {
        "classification": "live",
        "content_type": "text/html; charset=utf-8",
        "latency_ms": 209,
        "method_tested": "HEAD",
        "redirect_target": null,
        "status_code": 200,
        "verified_at": "2026-06-06T07:18:01.242Z"
      }
    },
    {
      "auth_required": false,
      "authority": "registry-observed",
      "id": "sn-102-website-common-docs",
      "kind": "docs",
      "name": "ConnitoAI docs",
      "notes": "Common read-only path discovered from a public project website root. Requires verification before promotion.",
      "probe": {
        "enabled": true,
        "expect": "any",
        "method": "HEAD",
        "timeout_ms": 10000
      },
      "provider": "taomarketcap",
      "public_safe": true,
      "rate_limit_notes": "Candidate only; no recurring probe is configured until maintainer review.",
      "source_urls": [
        "https://connito.ai/"
      ],
      "url": "https://connito.ai/docs",
      "verification": {
        "classification": "redirected",
        "content_type": "text/html; charset=utf-8",
        "latency_ms": 208,
        "method_tested": "HEAD",
        "redirect_target": "https://connito.ai/docs/miner/prerequisites",
        "status_code": 200,
        "verified_at": "2026-06-06T07:18:01.311Z"
      }
    },
    {
      "auth_required": false,
      "authority": "registry-observed",
      "id": "sn-102-website-link-connito-ai-docs-1",
      "kind": "docs",
      "name": "ConnitoAI docs",
      "notes": "Discovered from a public project website link. Requires verification before promotion.",
      "probe": {
        "enabled": true,
        "expect": "any",
        "method": "HEAD",
        "timeout_ms": 10000
      },
      "provider": "taomarketcap",
      "public_safe": true,
      "rate_limit_notes": "Candidate only; no recurring probe is configured until maintainer review.",
      "source_urls": [
        "https://connito.ai/"
      ],
      "url": "https://connito.ai/docs/miner/prerequisites",
      "verification": {
        "classification": "live",
        "content_type": "text/html; charset=utf-8",
        "latency_ms": 152,
        "method_tested": "HEAD",
        "redirect_target": null,
        "status_code": 200,
        "verified_at": "2026-06-06T07:18:01.366Z"
      }
    },
    {
      "auth_required": false,
      "authority": "registry-observed",
      "id": "sn-102-website-link-connito-ai-docs-3",
      "kind": "docs",
      "name": "ConnitoAI docs",
      "notes": "Discovered from a public project website link. Requires verification before promotion.",
      "probe": {
        "enabled": true,
        "expect": "any",
        "method": "HEAD",
        "timeout_ms": 10000
      },
      "provider": "taomarketcap",
      "public_safe": true,
      "rate_limit_notes": "Candidate only; no recurring probe is configured until maintainer review.",
      "source_urls": [
        "https://connito.ai/"
      ],
      "url": "https://connito.ai/whitepaper",
      "verification": {
        "classification": "live",
        "content_type": "text/html; charset=utf-8",
        "latency_ms": 168,
        "method_tested": "HEAD",
        "redirect_target": null,
        "status_code": 200,
        "verified_at": "2026-06-06T07:18:01.388Z"
      }
    },
    {
      "auth_required": false,
      "authority": "registry-observed",
      "id": "sn-102-taomarketcap-dashboard",
      "kind": "dashboard",
      "name": "ConnitoAI TaoMarketCap dashboard",
      "notes": "Universal TaoMarketCap subnet dashboard candidate. Third-party enrichment, not protocol authority.",
      "probe": {
        "enabled": true,
        "expect": "any",
        "method": "HEAD",
        "timeout_ms": 10000
      },
      "provider": "taomarketcap",
      "public_safe": true,
      "rate_limit_notes": "Candidate only; no recurring probe is configured until maintainer review.",
      "source_urls": [
        "https://api.taomarketcap.com/public/v1/subnets/102"
      ],
      "url": "https://taomarketcap.com/subnets/102",
      "verification": {
        "classification": "live",
        "content_type": "text/html; charset=utf-8",
        "latency_ms": 168,
        "method_tested": "HEAD",
        "redirect_target": null,
        "status_code": 200,
        "verified_at": "2026-06-06T07:18:01.240Z"
      }
    }
  ],
  "website_url": "https://connito.ai/"
}
