{
  "categories": [
    "baseline-curated"
  ],
  "curation": {
    "gap_notes": [
      "No verified source repository yet.",
      "No verified project website yet.",
      "No verified OpenAPI/Swagger surface yet.",
      "No verified subnet API surface yet.",
      "No verified SSE/event stream yet.",
      "No verified data artifact yet."
    ],
    "level": "machine-verified",
    "review_state": "machine-generated",
    "reviewed_at": null,
    "source_count": 2,
    "verified_at": "2026-06-06T07:17:30.915Z"
  },
  "dashboard_url": "https://taomarketcap.com/subnets/27",
  "docs_url": "https://github.com/tensorplex-labs/subnet-docs/tree/main/data/27",
  "links": [],
  "name": "Nodexo",
  "netuid": 27,
  "notes": "Machine-generated baseline overlay from verified public-source candidates.",
  "schema_version": 1,
  "slug": "sn-27",
  "status": "active",
  "surfaces": [
    {
      "auth_required": false,
      "authority": "registry-observed",
      "id": "sn-27-tensorplex-docs",
      "kind": "docs",
      "name": "Nodexo Tensorplex subnet docs",
      "notes": "Discovered from Tensorplex subnet-docs. Useful as documentation enrichment, not verified operational authority.",
      "probe": {
        "enabled": true,
        "expect": "any",
        "method": "HEAD",
        "timeout_ms": 10000
      },
      "provider": "tensorplex-subnet-docs",
      "public_safe": true,
      "rate_limit_notes": "Candidate only; no recurring probe is configured until maintainer review.",
      "source_urls": [
        "https://github.com/tensorplex-labs/subnet-docs/blob/main/data/27/subnet.json"
      ],
      "url": "https://github.com/tensorplex-labs/subnet-docs/tree/main/data/27",
      "verification": {
        "classification": "live",
        "content_type": "text/html; charset=utf-8",
        "latency_ms": 374,
        "method_tested": "HEAD",
        "redirect_target": null,
        "status_code": 200,
        "verified_at": "2026-06-06T07:17:30.915Z"
      }
    },
    {
      "auth_required": false,
      "authority": "registry-observed",
      "id": "sn-27-taomarketcap-dashboard",
      "kind": "dashboard",
      "name": "Nodexo TaoMarketCap dashboard",
      "notes": "Universal TaoMarketCap subnet dashboard candidate. Third-party enrichment, not protocol authority.",
      "probe": {
        "enabled": true,
        "expect": "any",
        "method": "HEAD",
        "timeout_ms": 10000
      },
      "provider": "taomarketcap",
      "public_safe": true,
      "rate_limit_notes": "Candidate only; no recurring probe is configured until maintainer review.",
      "source_urls": [
        "https://api.taomarketcap.com/public/v1/subnets/27"
      ],
      "url": "https://taomarketcap.com/subnets/27",
      "verification": {
        "classification": "live",
        "content_type": "text/html; charset=utf-8",
        "latency_ms": 156,
        "method_tested": "HEAD",
        "redirect_target": null,
        "status_code": 200,
        "verified_at": "2026-06-06T07:17:30.892Z"
      }
    }
  ]
}
